1,1,Sport,Which country won the 2010 FIFA World Cup?,"European team","Known for tiki-taka","Final against Netherlands","Flag has red and yellow",Spain,Germany,Italy,Portugal,1
2,1,Sport,Who holds the record for the most Grand Slam titles in men's tennis?,"Modern era","Swiss player","Retired","Known for elegance",Roger Federer,Rafael Nadal,Novak Djokovic,Andy Murray,1
3,1,Sport,What sport uses a shuttlecock?,"Indoor or outdoor","Racket sport","Popular in Asia","Played in pairs or singles",Badminton,Tennis,Table Tennis,Squash,1
4,1,Sport,Which athlete is known as 'The Lightning'?,"Track and field","Sprinter","From Jamaica","World record holder",Usain Bolt,Carl Lewis,Tyson Gay,Yohan Blake,1
5,1,Sport,Which sport features a pommel horse?,"Gymnastics event","Requires upper-body strength","Men’s artistic category","Uses handles",Gymnastics,Diving,Wrestling,Weightlifting,1
6,1,Sport,Where did the Olympic Games originate?,"Ancient times","Europe","Athletes competed nude","Mount Olympus",Greece,Italy,France,Turkey,1
7,1,Sport,Which sport includes the terms 'birdie' and 'eagle'?,"Outdoor","Uses clubs","Uses a ball","18 holes",Golf,Baseball,Cricket,Hockey,1
8,1,Sport,What is the national sport of Japan?,"Martial art","Ritual introduction","Heavyweight athletes","Circle ring",Sumo,Judo,Karate,Kendo,1
9,1,Sport,In which sport would you perform a 'slam dunk'?,"Team sport","Uses a hoop","Indoor court","Ball is thrown downward into the basket",Basketball,Volleyball,Handball,Rugby,1